{
  "$schema": "http://json-schema.org/draft-07/schema#",
  "meta": {
    "project": "Heisenberg - RxNav Drug Search",
    "auditDate": "2025-10-04",
    "auditor": "LLM Accessibility Audit (Manual Code Review)",
    "protocolVersion": "2.0.0",
    "wcagVersion": "2.2",
    "wcagLevel": "AA",
    "limitations": [
      "eslint-plugin-jsx-a11y installed but not configured in eslint.config.js",
      "jest-axe not installed - runtime validation not performed",
      "@axe-core/playwright not installed - E2E validation not performed",
      "Manual code review only - may miss dynamic/runtime issues",
      "Theme color contrast requires manual WebAIM validation - not performed",
      "Keyboard navigation requires manual testing - not performed",
      "Screen reader testing not performed"
    ],
    "detectionMethod": "manual-code-review"
  },
  "summary": {
    "totalCriteria": 60,
    "passing": 45,
    "failing": 3,
    "notApplicable": 12,
    "compliancePercentage": 93.75,
    "note": "Percentage based on applicable criteria (48 of 60)",
    "severityBreakdown": {
      "critical": 1,
      "high": 2,
      "medium": 0,
      "low": 0
    }
  },
  "findings": [
    {
      "id": "WCAG-2.4.7-001",
      "criterion": "2.4.7",
      "criterionName": "Focus Visible",
      "wcagLevel": "AA",
      "status": "fail",
      "severity": "critical",
      "description": "Tab panel explicitly removes focus outline on keyboard-focusable element, making it impossible for keyboard users to see where focus is when navigating between tabs.",
      "affectedFiles": ["src/features/drug-detail/components/DrugDetail.tsx:269"],
      "evidence": {
        "codeSnippet": "<Box\n  role=\"tabpanel\"\n  hidden={!isActive}\n  id={`drug-detail-tabpanel-${value}`}\n  aria-labelledby={`drug-detail-tab-${value}`}\n  tabIndex={isActive ? 0 : -1}\n  sx={{ outline: 'none' }}  // ❌ VIOLATION\n  ref={ref}\n>",
        "lineNumbers": [263, 264, 265, 266, 267, 268, 269, 270, 271],
        "detectionMethod": "manual"
      },
      "impact": "Completely blocks keyboard users from seeing focus state when navigating tab content",
      "likelihood": "All keyboard users using tabs encounter this",
      "severityJustification": "Impact: Blocker (cannot see focus) × Likelihood: All keyboard users = CRITICAL",
      "wcagReference": "https://www.w3.org/WAI/WCAG22/quickref/#focus-visible",
      "remediation": {
        "description": "Remove outline: 'none' or replace with visible focus indicator",
        "codeExample": "// Option 1: Remove outline suppression entirely\n<Box\n  role=\"tabpanel\"\n  tabIndex={isActive ? 0 : -1}\n  // Remove: sx={{ outline: 'none' }}\n  ref={ref}\n>\n\n// Option 2: Replace with custom focus indicator\n<Box\n  role=\"tabpanel\"\n  tabIndex={isActive ? 0 : -1}\n  sx={{\n    '&:focus-visible': {\n      outline: '2px solid',\n      outlineColor: 'primary.main',\n      outlineOffset: '2px',\n    },\n  }}\n  ref={ref}\n>",
        "estimatedEffort": "5 minutes"
      }
    },
    {
      "id": "WCAG-2.4.1-001",
      "criterion": "2.4.1",
      "criterionName": "Bypass Blocks",
      "wcagLevel": "A",
      "status": "fail",
      "severity": "high",
      "description": "No skip navigation link provided to bypass the AppBar navigation and jump directly to main content.",
      "affectedFiles": ["src/app/App.tsx:35-131"],
      "evidence": {
        "codeSnippet": "// Missing skip link before AppBar\n<Box sx={{ minHeight: '100vh', ... }}>\n  <AppBar position=\"static\" ...>\n    {/* Header content */}\n  </AppBar>\n  <Container component=\"main\" maxWidth=\"lg\">\n    {/* Main content */}\n  </Container>\n</Box>",
        "lineNumbers": [35, 44, 110],
        "detectionMethod": "manual"
      },
      "impact": "Keyboard users must tab through entire AppBar on every page/view change",
      "likelihood": "All keyboard users encounter this",
      "severityJustification": "Impact: Friction (annoying but workaroundable) × Likelihood: All users = HIGH. AppBar has ~5 items, not 50, so not CRITICAL but still HIGH impact.",
      "wcagReference": "https://www.w3.org/WAI/WCAG22/quickref/#bypass-blocks",
      "remediation": {
        "description": "Add skip link before AppBar that jumps to main content",
        "codeExample": "<Box sx={{ minHeight: '100vh', ... }}>\n  {/* ADD: Skip navigation link */}\n  <Box\n    component=\"a\"\n    href=\"#main-content\"\n    sx={{\n      position: 'absolute',\n      left: '-9999px',\n      zIndex: 9999,\n      padding: '1rem',\n      backgroundColor: 'primary.main',\n      color: 'primary.contrastText',\n      '&:focus': {\n        left: '50%',\n        top: '1rem',\n        transform: 'translateX(-50%)',\n      },\n    }}\n  >\n    Skip to main content\n  </Box>\n\n  <AppBar ...>\n    {/* ... */}\n  </AppBar>\n\n  <Container id=\"main-content\" component=\"main\" ...>\n    {/* ... */}\n  </Container>\n</Box>",
        "estimatedEffort": "15 minutes"
      }
    },
    {
      "id": "WCAG-1.4.3-001",
      "criterion": "1.4.3",
      "criterionName": "Contrast (Minimum)",
      "wcagLevel": "AA",
      "status": "manual-required",
      "severity": "high",
      "description": "Theme color contrast ratios not validated. MUI theme colors must be checked against WCAG requirements (4.5:1 for normal text, 3:1 for large text/UI components).",
      "affectedFiles": ["src/theme/ (theme configuration location unknown)"],
      "evidence": {
        "codeSnippet": "// Theme colors used throughout app but not validated:\n// - theme.palette.primary.main\n// - theme.palette.text.secondary\n// - theme.palette.divider\n// - theme.palette.action.disabled\n// etc.",
        "lineNumbers": [],
        "detectionMethod": "manual"
      },
      "impact": "Potentially blocks users with low vision or color blindness if contrast is insufficient",
      "likelihood": "Unknown - depends on actual theme colors",
      "severityJustification": "HIGH severity assumed until validated. If MUI defaults are used, likely passing. If custom theme, unknown.",
      "wcagReference": "https://www.w3.org/WAI/WCAG22/quickref/#contrast-minimum",
      "remediation": {
        "description": "Extract all theme colors and validate using WebAIM Contrast Checker. Document results in theme configuration.",
        "codeExample": "// src/theme/index.ts\n/**\n * WCAG 2.2 Level AA Contrast Validation\n * Tool: https://webaim.org/resources/contrastchecker/\n *\n * Validated ratios:\n * - primary.main (#1976d2) on white: 4.59:1 ✅ PASS\n * - text.secondary (rgba(0,0,0,0.6)) on white: 7.68:1 ✅ PASS\n * - text.disabled (rgba(0,0,0,0.38)) on white: 4.5:1 ✅ PASS (large text)\n */\n\nexport const theme = createTheme({\n  palette: {\n    primary: { main: '#1976d2' }, // Validated\n    // ...\n  },\n});",
        "estimatedEffort": "1 hour"
      }
    }
  ],
  "notApplicableCriteria": [
    {
      "id": "1.3.5",
      "name": "Identify Input Purpose",
      "reason": "Search input is not collecting user profile data (not in WCAG Section 7 list of 53 purposes)"
    },
    {
      "id": "1.2.1",
      "name": "Audio-only and Video-only",
      "reason": "No audio or video content in application"
    },
    {
      "id": "1.2.2",
      "name": "Captions (Prerecorded)",
      "reason": "No audio or video content"
    },
    {
      "id": "1.2.3",
      "name": "Audio Description or Media Alternative",
      "reason": "No video content"
    },
    {
      "id": "1.2.4",
      "name": "Captions (Live)",
      "reason": "No live audio content"
    },
    {
      "id": "1.2.5",
      "name": "Audio Description (Prerecorded)",
      "reason": "No video content"
    },
    {
      "id": "1.4.2",
      "name": "Audio Control",
      "reason": "No auto-playing audio"
    },
    {
      "id": "2.2.1",
      "name": "Timing Adjustable",
      "reason": "No time limits in application"
    },
    {
      "id": "2.4.5",
      "name": "Multiple Ways",
      "reason": "Application has Search → Detail → Performance Dashboard (3 routes). However, it's primarily a single-function search tool. Borderline N/A. Document as passing with single navigation method (search) as primary function."
    },
    {
      "id": "3.2.6",
      "name": "Consistent Help",
      "reason": "No help mechanism exists - PASSES (only fails if help exists but inconsistently placed)"
    },
    {
      "id": "3.3.8",
      "name": "Accessible Authentication (Minimum)",
      "reason": "No authentication in application"
    },
    {
      "id": "4.1.1",
      "name": "Parsing",
      "reason": "Obsolete in WCAG 2.2"
    }
  ],
  "passingCriteria": [
    {
      "id": "1.1.1",
      "name": "Non-text Content",
      "reason": "MUI icons automatically add aria-hidden='true' when titleAccess is undefined. All decorative icons properly handled."
    },
    {
      "id": "1.3.1",
      "name": "Info and Relationships",
      "reason": "Semantic HTML with proper landmarks (header, nav, main, footer). MUI components provide proper ARIA relationships."
    },
    {
      "id": "1.3.2",
      "name": "Meaningful Sequence",
      "reason": "DOM order matches visual order"
    },
    {
      "id": "1.3.3",
      "name": "Sensory Characteristics",
      "reason": "Instructions don't rely solely on sensory characteristics"
    },
    {
      "id": "1.3.4",
      "name": "Orientation",
      "reason": "No orientation locks found. Responsive design works in both portrait and landscape."
    },
    {
      "id": "1.4.1",
      "name": "Use of Color",
      "reason": "MUI Alert components include icons (not color-only). Status indicated with text + icons."
    },
    {
      "id": "2.1.1",
      "name": "Keyboard",
      "reason": "All functionality uses MUI components with built-in keyboard support"
    },
    {
      "id": "2.1.2",
      "name": "No Keyboard Trap",
      "reason": "No keyboard traps detected in code review"
    },
    {
      "id": "2.1.4",
      "name": "Character Key Shortcuts",